{"schemaVersion":2,"capabilities":["status.configured.read","game.control.core"],"boot":"12345678ABCDEF01","sample":1,"sampledMilliseconds":286,"application":{"phase":"ready","configurationRevision":1,"profileRevision":3,"draftRevision":2,"deviceGeneration":1,"storedGeneration":1,"storedProfileRevision":3,"hasActive":true,"draftReady":false,"hardwareReady":true,"storedMatchesActive":true},"control":{"lease":1,"nextRequest":1},"game":{"running":false,"paused":false,"entryPending":false,"state":null,"lastTransition":0,"stateRevision":0,"stateElapsedMilliseconds":0,"role":null,"crystalCount":0,"requiredCrystals":0,"seenRoleCount":0,"roundCount":0,"audioPending":false,"incorrectCrystal":false,"keystoneError":false,"rejectedActions":0,"unavailableActions":0,"lastTickOutcome":"ok"},"devices":[]}
