{"schemaVersion":2,"capabilities":["status.configured.read","game.control.core"],"boot":"12345678ABCDEF01","sample":2,"sampledMilliseconds":816,"application":{"phase":"fault","configurationRevision":2,"profileRevision":4,"draftRevision":4,"deviceGeneration":2,"storedGeneration":1,"storedProfileRevision":3,"hasActive":true,"draftReady":false,"hardwareReady":true,"storedMatchesActive":false},"control":{"lease":1,"nextRequest":1},"game":{"running":false,"paused":false,"entryPending":false,"state":null,"lastTransition":0,"stateRevision":0,"stateElapsedMilliseconds":0,"role":null,"crystalCount":0,"requiredCrystals":0,"seenRoleCount":0,"roundCount":0,"audioPending":false,"incorrectCrystal":false,"keystoneError":false,"rejectedActions":0,"unavailableActions":0,"lastTickOutcome":"ok"},"devices":[{"id":1,"enabled":true,"available":true,"cardReadable":true,"matrixReadable":true,"pollPending":false,"lastOutcome":"unavailable"},{"id":2,"enabled":true,"available":true,"cardReadable":true,"matrixReadable":true,"pollPending":false,"lastOutcome":"unavailable"},{"id":3,"enabled":true,"available":true,"cardReadable":true,"matrixReadable":true,"pollPending":false,"lastOutcome":"unavailable"},{"id":4,"enabled":true,"available":true,"cardReadable":true,"matrixReadable":true,"pollPending":false,"lastOutcome":"unavailable"},{"id":5,"enabled":true,"available":true,"cardReadable":true,"matrixReadable":true,"pollPending":false,"lastOutcome":"unavailable"},{"id":6,"enabled":true,"available":true,"cardReadable":true,"matrixReadable":true,"pollPending":false,"lastOutcome":"unavailable"},{"id":7,"enabled":true,"available":true,"cardReadable":true,"matrixReadable":true,"pollPending":false,"lastOutcome":"unavailable"}]}
