{"schemaVersion":2,"capabilities":["status.configured.read","game.control.core"],"boot":"12345678ABCDEF01","sample":4,"sampledMilliseconds":290,"application":{"phase":"ready","configurationRevision":1,"profileRevision":3,"draftRevision":2,"deviceGeneration":1,"storedGeneration":1,"storedProfileRevision":3,"hasActive":true,"draftReady":false,"hardwareReady":true,"storedMatchesActive":true},"control":{"lease":3,"nextRequest":1},"game":{"running":true,"paused":false,"entryPending":true,"state":1,"lastTransition":0,"stateRevision":1,"stateElapsedMilliseconds":0,"role":null,"crystalCount":0,"requiredCrystals":0,"seenRoleCount":0,"roundCount":0,"audioPending":false,"incorrectCrystal":false,"keystoneError":false,"rejectedActions":0,"unavailableActions":0,"lastTickOutcome":"ok"},"devices":[{"id":1,"enabled":true,"available":true,"cardReadable":true,"matrixReadable":true,"pollPending":false,"lastOutcome":"applied"},{"id":2,"enabled":true,"available":true,"cardReadable":true,"matrixReadable":true,"pollPending":false,"lastOutcome":"applied"},{"id":3,"enabled":true,"available":true,"cardReadable":true,"matrixReadable":true,"pollPending":false,"lastOutcome":"applied"},{"id":4,"enabled":true,"available":true,"cardReadable":true,"matrixReadable":true,"pollPending":false,"lastOutcome":"applied"},{"id":5,"enabled":true,"available":true,"cardReadable":true,"matrixReadable":true,"pollPending":false,"lastOutcome":"applied"},{"id":6,"enabled":true,"available":true,"cardReadable":true,"matrixReadable":true,"pollPending":false,"lastOutcome":"applied"},{"id":7,"enabled":true,"available":true,"cardReadable":true,"matrixReadable":true,"pollPending":false,"lastOutcome":"applied"}]}
